{
  "$schema": "http://json-schema.org/draft-04/schema#",
  "id": "http://seisprov.org/internal_type_def",
  "type": "object",
  "properties": {
    "package": {
      "id": "http://seisprov.org/internal_type_def/package",
      "type": "string",
      "enum": ["seis_prov"]
    },
    "type": {
      "id": "http://seisprov.org/internal_type_def/type",
      "type": "string",
      "enum": ["entity", "activity"]
    },
    "name": {
      "id": "http://seisprov.org/internal_type_def/name",
      "type": "string",
      "pattern": "[a-z_]{4,}"
    },
    "two_letter_code": {
      "id": "http://seisprov.org/internal_type_def/two_letter_code",
      "type": "string",
      "pattern": "^[a-z]{2}$"
    },
    "recommended_label": {
      "id": "http://seisprov.org/internal_type_def/recommended_label",
      "type": "string",
      "pattern": "^[a-zA-Z ]{4,}$"
    },
    "description": {
      "id": "http://seisprov.org/internal_type_def/description",
      "type": "string"
    },
    "attributes": {
      "id": "http://seisprov.org/internal_type_def/attributes",
      "type": "array",
      "items": {
        "id": "http://seisprov.org/internal_type_def/attributes/0",
        "type": "object",
        "additionalProperties": false,
        "properties": {
          "name": {
            "id": "http://seisprov.org/internal_type_def/attributes/name",
            "type": "string",
            "pattern": "^[a-z_]+"
          },
          "type": {
            "id": "http://seisprov.org/internal_type_def/attributes/type",
            "type": "string",
            "enum": ["xsd:string", "xsd:byte", "xsd:decimal", "xsd:int",
                     "xsd:integer", "xsd:long", "xsd:negativeInteger",
                     "xsd:nonNegativeInteger", "xsd:nonPositiveInteger",
                     "xsd:positiveInteger", "xsd:short", "xsd:unsignedLong",
                     "xsd:unsignedInt", "xsd:unsignedShort",
                     "xsd:unsignedByte", "xsd:date", "xsd:dateTime",
                     "xsd:duration", "xsd:gDay", "xsd:gMonth", "xsd:gMonthDay",
                     "xsd:gYear", "xsd:gYearMonth", "xsd:time", "xsd:anyURI",
                     "xsd:base64Binary", "xsd:boolean", "xsd:double",
                     "xsd:float", "xsd:hexBinary"]
          },
          "pattern": {
            "id": "http://seisprov.org/internal_type_def/attributes/pattern",
            "type": "string"
          },
          "description": {
            "id": "http://seisprov.org/internal_type_def/attributes/description",
            "type": "string"
          },
          "required": {
            "id": "http://seisprov.org/internal_type_def/attributes/required",
            "type": "boolean"
          },
          "example_value": {
            "id": "http://seisprov.org/internal_type_def/attributes/example_value"
          }
        },
        "required": ["name", "type", "description", "required", "example_value"]
      }
    }
  },
  "additionalProperties": false,
  "required": [
    "package",
    "type",
    "name",
    "two_letter_code",
    "recommended_label",
    "description",
    "attributes"
  ]
}
