{
    "package": "seis_prov",
    "type": "activity",
    "name": "decimate",
    "two_letter_code": "dc",
    "recommended_label": "Decimate",
    "description": "Downsample the waveform data by an integer factor. Any applied anti-alias filtering has to be described by a filtering activity.",
    "attributes": [
        {
            "name": "factor",
            "type": "xsd:positiveInteger",
            "description": "The decimation factor",
            "required": true,
            "example_value": 5
        }
    ]
}
