{
    "package": "seis_prov",
    "type": "activity",
    "name": "interpolate",
    "two_letter_code": "ip",
    "recommended_label": "Interpolate",
    "description": "Interpolate the data to new sampling points.",
    "attributes": [
        {
            "name": "interpolation_method",
            "type": "xsd:string",
            "description": "The method used to interpolate the samples.",
            "required": true,
            "example_value": "cubic spline"
        },
        {
            "name": "new_start_time",
            "type": "xsd:dateTime",
            "description": "The time of the first sample in UTC after the interpolation.",
            "required": false,
            "example_value": "2012-04-23T18:25:43.511Z"
        },
        {
            "name": "new_number_of_samples",
            "type": "xsd:positiveInteger",
            "description": "The number of samples after the interpolation.",
            "required": false,
            "example_value": 5000
        },
        {
            "name": "new_sampling_rate",
            "type": "xsd:double",
            "description": "The sampling rate after the interpolation.",
            "required": true,
            "example_value": 10.0
        }
    ]
}
