{
    "package": "seis_prov",
    "type": "activity",
    "name": "rotate",
    "two_letter_code": "rt",
    "recommended_label": "Rotate",
    "description": "Rotate multi-component data. This activity has no other attributes. The rotation angles are described by input and output activities.",
    "attributes": [
    ]
}
